{
  "expect": {
    "effect": "enqueue",
    "reason_code": "exact_head_gates_passed",
    "role_sequence": [
      "review_merge"
    ],
    "route": "review_merge",
    "terminal": "merged"
  },
  "id": "clean_ci_pass",
  "schema": "switchboard.completion_conformance.scenario.v1",
  "timing": {
    "ci_delay_seconds": 0,
    "close_pr_while_runner_live": false,
    "hang_seconds": 0,
    "move_head_during_assessment": false,
    "never_report": false
  },
  "world": {
    "ci": "pass",
    "ci_attribution": "product",
    "ci_context": "Switchboard CI / VM gate",
    "draft": false,
    "merge_state_status": "CLEAN",
    "mergeable": true,
    "queue": "none",
    "review": "passed",
    "runner": {
      "head": "none",
      "live": false,
      "role": "none"
    }
  }
}
