{
  "expect": {
    "effect": "start_remediation",
    "reason_code": "pr_merge_conflict",
    "role_sequence": [
      "remediation"
    ],
    "route": "remediation",
    "terminal": "blocked"
  },
  "id": "merge_conflict",
  "schema": "switchboard.completion_conformance.scenario.v1",
  "timing": {
    "ci_delay_seconds": 0,
    "close_pr_while_runner_live": false,
    "hang_seconds": 0,
    "move_head_during_assessment": false,
    "never_report": false
  },
  "world": {
    "ci": "pass",
    "ci_attribution": "product",
    "ci_context": "Switchboard CI / VM gate",
    "draft": false,
    "merge_state_status": "DIRTY",
    "mergeable": false,
    "queue": "none",
    "review": "passed",
    "runner": {
      "head": "none",
      "live": false,
      "role": "none"
    }
  }
}
