{
  "expect": {
    "effect": "attach_and_wait",
    "reason_code": "review_required",
    "role_sequence": [
      "review_merge"
    ],
    "route": "review_merge",
    "terminal": "merged"
  },
  "id": "review_merge_attaches_matching_generation",
  "schema": "switchboard.completion_conformance.scenario.v1",
  "timing": {
    "ci_delay_seconds": 0,
    "close_pr_while_runner_live": false,
    "hang_seconds": 0,
    "move_head_during_assessment": false,
    "never_report": false
  },
  "world": {
    "ci": "pass",
    "ci_attribution": "product",
    "ci_context": "Switchboard CI / VM gate",
    "draft": false,
    "merge_state_status": "CLEAN",
    "mergeable": true,
    "queue": "none",
    "review": "missing",
    "runner": {
      "head": "same",
      "live": true,
      "role": "review_merge"
    }
  }
}
