{
  "expect": {
    "terminal": "blocked",
    "reason_code": "required_exact_head_ci_failed",
    "role_sequence": [
      "remediation"
    ],
    "route": "remediation",
    "effect": "start_remediation"
  },
  "id": "clean_ci_action_required",
  "schema": "switchboard.completion_conformance.scenario.v1",
  "timing": {
    "ci_delay_seconds": 0,
    "close_pr_while_runner_live": false,
    "hang_seconds": 0,
    "move_head_during_assessment": false,
    "never_report": false
  },
  "world": {
    "ci": "action_required",
    "ci_attribution": "product",
    "ci_context": "Switchboard CI / VM gate",
    "draft": false,
    "merge_state_status": "BLOCKED",
    "mergeable": true,
    "queue": "none",
    "review": "passed",
    "runner": {
      "head": "none",
      "live": false,
      "role": "none"
    }
  }
}
