{
  "expect": {
    "effect": "wait",
    "reason_code": "merge_queue_awaiting_checks",
    "role_sequence": [],
    "route": "wait",
    "terminal": "blocked"
  },
  "id": "queue_awaiting",
  "schema": "switchboard.completion_conformance.scenario.v1",
  "timing": {
    "ci_delay_seconds": 0,
    "close_pr_while_runner_live": false,
    "hang_seconds": 0,
    "move_head_during_assessment": false,
    "never_report": false
  },
  "world": {
    "ci": "pass",
    "ci_attribution": "product",
    "ci_context": "Switchboard CI / VM gate",
    "draft": false,
    "merge_state_status": "CLEAN",
    "mergeable": true,
    "queue": "queued",
    "review": "passed",
    "runner": {
      "head": "none",
      "live": false,
      "role": "none"
    }
  }
}
