{
  "expect": {
    "effect": "requeue_merge_group",
    "reason_code": "merge_queue_ejected_tip_green",
    "role_sequence": [],
    "route": "coordination_retry",
    "terminal": "merged"
  },
  "id": "tip_green_after_checks_timed_out",
  "schema": "switchboard.completion_conformance.scenario.v1",
  "timing": {
    "ci_delay_seconds": 0,
    "close_pr_while_runner_live": false,
    "hang_seconds": 0,
    "move_head_during_assessment": false,
    "never_report": false
  },
  "world": {
    "ci": "pass",
    "ci_attribution": "product",
    "ci_context": "Switchboard CI / VM gate",
    "draft": false,
    "merge_state_status": "CLEAN",
    "mergeable": true,
    "queue": "ejected",
    "queue_removal_reason": "checks_timed_out",
    "review": "passed",
    "runner": {
      "head": "none",
      "live": false,
      "role": "none"
    }
  }
}
