{
  "schema": "switchboard.completion_conformance.scenario.v1",
  "id": "partial_required_ci_pending",
  "expect": {
    "terminal": "blocked",
    "reason_code": "required_exact_head_ci_pending",
    "role_sequence": [],
    "route": "wait",
    "effect": "wait"
  },
  "world": {
    "draft": false,
    "ci": "pass",
    "ci_context": "Switchboard CI / VM gate",
    "ci_attribution": "product",
    "also_pending_contexts": ["Switchboard UI / Playwright"],
    "review": "passed",
    "mergeable": true,
    "merge_state_status": "BLOCKED",
    "queue": "none",
    "runner": {"live": false, "role": "none", "head": "none"}
  },
  "timing": {
    "ci_delay_seconds": 0,
    "never_report": false,
    "hang_seconds": 0,
    "close_pr_while_runner_live": false,
    "move_head_during_assessment": false
  }
}
